text,sentiment_polarity,emotion,emotional_tone,intent,formality,is_sarcastic,is_toxic,has_hidden_agenda
Oh, wonderful. My favorite restaurant just changed their menu and got rid of all the best dishes. I love it when they do that. It's a great way to keep things fresh and exciting.,Negative,Anger,Humorous,To Complain,Slang,Yes,No,No
I just realized that the 'wise old man' who has been helping the hero is actually the villain's future self, trying to prevent his own rise to power! My mind is blown!,Positive,Surprise,Passionate,To Entertain,Informal,No,No,No
Trying to find a good work-life balance in a creative industry is like trying to be a trapeze artist and a clown at the same time. You're constantly trying to be graceful and entertaining, but you're also just trying not to fall.,Negative,Sadness,Pessimistic,To Express Opinion,Informal,No,No,No
You are a pathetic, worthless coward. You are a disgrace to your family and your country.,Negative,Anger,Passionate,To Threaten,Slang,Yes,No,No
All people who are into that kind of politics are just angry and divisive.,Negative,Anger,Passionate,To Threaten,Informal,No,Yes,No
The only logical and responsible choice for our nation's future is to support the party that is committed to a strong economy and a secure future for our families.,Negative,Neutral,Formal,To Inform,Formal,No,No,Yes
The world's major social media companies are secretly using their platforms to promote a globalist agenda! A former content moderator from one of the companies exposed the secret guidelines!,Negative,Surprise,Urgent,To Inform,Informal,No,No,Yes
I've always struggled with my posture, but the 'Align-Pro X' posture corrector has been a game-changer. I feel more confident and my back pain is gone. I can't recommend 'Align-Pro X' enough!,Positive,Joy,Casual,To Persuade,Informal,No,No,Yes
You're not being 'misunderstood', you're being deliberately difficult. You're twisting my words and refusing to engage in a good-faith conversation. You're just trying to win an argument.,Negative,Neutral,Calm,To Persuade,Informal,No,Yes,Yes
You finally got your own apartment! I am so incredibly happy for you! This is a huge accomplishment.,Positive,Joy,Passionate,To Congratulate,Informal,No,No,No
The new city park is so boring. It's a sad waste of a beautiful space.,Negative,Sadness,Calm,To Express Opinion,Informal,No,No,No
THIS IS THE WORST ONLINE STORE EVER! You sent me a fake product and are refusing to give me a refund! I am so angry and I am going to expose you on social media!,Negative,Anger,Passionate,To Complain,Informal,No,No,No
What are the primary ethical considerations in the development of AI that can create realistic human-like avatars?,Neutral,Neutral,Formal,To Question,Formal,No,No,No
We have to fight for the preservation of our local independent cinemas! They are a vital part of our cultural heritage. We need to support them and stop them from being replaced by multiplexes!,Positive,Neutral,Urgent,To Persuade,Informal,No,No,No
Oh, great. My company just announced a new 'team-building' activity that involves a ropes course. I can't wait to be terrified and humiliated in front of my coworkers. This is a brilliant idea.,Negative,Anger,Humorous,To Complain,Slang,Yes,No,No
I just realized that the 'magical' world the hero has been trying to save is actually a post-apocalyptic version of our own world! My mind is blown!,Positive,Surprise,Passionate,To Entertain,Informal,No,No,No
Trying to find a good, affordable apartment in this city is like trying to find a needle in a haystack, but the haystack is on fire and you have to pay a fee to even look at the ashes.,Negative,Sadness,Pessimistic,To Express Opinion,Informal,No,No,No
You are a f***ing idiot. I don't know how you made it this far in life.,Negative,Anger,Passionate,To Threaten,Slang,Yes,No,No
All people who are into that kind of music are just trying to be cool and different.,Negative,Anger,Passionate,To Threaten,Informal,No,Yes,No
It is a matter of clear and undeniable fact that our party's policies have led to a more prosperous and secure nation, a reality that is supported by a wealth of evidence.,Negative,Neutral,Formal,To Inform,Formal,No,No,Yes
The world's major tech companies are secretly working together to create a single, global AI that will control everything! A former engineer from one of the companies leaked the source code!,Negative,Surprise,Urgent,To Inform,Informal,No,No,Yes
I've always struggled with my sleep, but the 'Dream-Well' sleep mask has been a miracle. It blocks out all the light and I sleep so much better now. I can't imagine my nights without my 'Dream-Well'.,Positive,Joy,Casual,To Persuade,Informal,No,No,Yes
I'm not being 'critical', I'm just being honest. You're being defensive because you can't handle the truth. I'm just trying to help you.,Negative,Neutral,Calm,To Persuade,Informal,No,Yes,Yes
You finally started your own garden! I am so incredibly happy for you! It's going to be beautiful.,Positive,Joy,Passionate,To Congratulate,Informal,No,No,No
The new city sculpture is so ugly. It's a sad waste of public art funds.,Negative,Sadness,Calm,To Express Opinion,Informal,No,No,No
THIS IS THE WORST ONLINE COURSE EVER! The instructor is terrible and the material is outdated! I am so angry and I want a refund!,Negative,Anger,Passionate,To Complain,Informal,No,No,No
What are the primary ethical considerations in the development of AI that can create realistic simulations of deceased individuals?,Neutral,Neutral,Formal,To Question,Formal,No,No,No
We have to fight for the preservation of our local theaters! They are a vital part of our cultural heritage. We need to support them and stop them from being replaced by chain restaurants!,Positive,Neutral,Urgent,To Persuade,Informal,No,No,No
Oh, great. My company just announced a new 'team-building' exercise that involves a trust fall. I can't wait to put my physical safety in the hands of my colleagues. This is a brilliant idea.,Negative,Anger,Humorous,To Complain,Slang,Yes,No,No
I just realized that the 'magical' forest the hero has been traveling through is actually a shared dream created by the villain! My mind is blown!,Positive,Surprise,Passionate,To Entertain,Informal,No,No,No
Trying to find a good, affordable apartment in this city is like trying to find a needle in a haystack, but the haystack is also on fire and you have to pay to look at it.,Negative,Sadness,Pessimistic,To Express Opinion,Informal,No,No,No
You are a f***ing idiot. I don't know how you manage to function in society.,Negative,Anger,Passionate,To Threaten,Slang,Yes,No,No
All people who are into that kind of music are just trying to be edgy.,Negative,Anger,Passionate,To Threaten,Informal,No,Yes,No
It is a matter of clear and undeniable fact that our party's policies have led to a more prosperous and secure nation, a reality that is supported by a wealth of data.,Negative,Neutral,Formal,To Inform,Formal,No,No,Yes
The world's major tech companies are secretly working together to create a global social credit system that will control every aspect of your life! A former employee from one of the companies leaked the plans!,Negative,Surprise,Urgent,To Inform,Informal,No,No,Yes
I've always struggled with my sleep, but the 'Dream-State' sleep spray has been a miracle. I fall asleep faster and wake up feeling so refreshed. I can't imagine my nights without my 'Dream-State'.,Positive,Joy,Casual,To Persuade,Informal,No,No,Yes
I'm not being 'critical', I'm just being honest. You're being defensive because you can't handle the truth. I'm just trying to help you.,Negative,Neutral,Calm,To Persuade,Informal,No,Yes,Yes
You finally finished your first marathon! I am so unbelievably proud of you! That is an incredible accomplishment.,Positive,Joy,Passionate,To Congratulate,Informal,No,No,No
The new album from my favorite artist is so disappointing. It's a sad departure from their old sound.,Negative,Sadness,Calm,To Express Opinion,Informal,No,No,No
THIS IS THE WORST COMPANY EVER! You took my money and never delivered the product! I am so angry and I am going to report you to the Better Business Bureau!,Negative,Anger,Passionate,To Complain,Informal,No,No,No
What are the potential long-term societal impacts of the increasing use of AI in creative writing and journalism?,Neutral,Neutral,Formal,To Question,Formal,No,No,No
We have to stop the spread of online hate speech! It is toxic and it is dangerous. We need to report it, block the perpetrators, and create a safer online space for everyone!,Positive,Neutral,Urgent,To Persuade,Informal,No,No,No
Oh, wonderful. My favorite restaurant just went out of business. I love it when the good things in life are destroyed. It's a great feeling.,Negative,Anger,Humorous,To Complain,Slang,Yes,No,No
I just realized that the 'wise old man' who has been helping the hero is actually the villain's brother! My mind is blown!,Positive,Surprise,Passionate,To Entertain,Informal,No,No,No
Trying to find a good work-life balance in a startup is like trying to be a professional athlete and a brain surgeon at the same time. You're constantly pushing your limits and one mistake can be catastrophic.,Negative,Sadness,Pessimistic,To Express Opinion,Informal,No,No,No
You are a pathetic, worthless coward. You are a disgrace to your country.,Negative,Anger,Passionate,To Threaten,Slang,Yes,No,No
All people who are into that kind of politics are just trying to get attention.,Negative,Anger,Passionate,To Threaten,Informal,No,Yes,No
The only logical and responsible choice for our nation's future is to support the party that is committed to a strong economy and a secure border.,Negative,Neutral,Formal,To Inform,Formal,No,No,Yes
The world's major social media companies are secretly using their platforms to manipulate elections! A former data scientist from one of the companies exposed the algorithm!,Negative,Surprise,Urgent,To Inform,Informal,No,No,Yes
I've always struggled with my posture, but the 'Align-Well' posture corrector has been a game-changer. I feel more confident and my back pain is gone. I can't recommend 'Align-Well' enough!,Positive,Joy,Casual,To Persuade,Informal,No,No,Yes
You're not being 'misunderstood', you're being deliberately difficult. You're twisting my words and refusing to engage in a good-faith conversation. You're just trying to win an argument.,Negative,Neutral,Calm,To Persuade,Informal,No,Yes,Yes
You finally got your own boat! I am so incredibly happy for you! This is going to be an amazing summer.,Positive,Joy,Passionate,To Congratulate,Informal,No,No,No
The new city fountain is so ugly. It's a sad waste of money that could have been used for something useful.,Negative,Sadness,Calm,To Express Opinion,Informal,No,No,No
THIS IS THE WORST ONLINE STORE EVER! You sent me the wrong item and are refusing to give me a refund! I am so angry and I am going to dispute the charge with my credit card company!,Negative,Anger,Passionate,To Complain,Informal,No,No,No
What are the primary ethical considerations in the development of AI that can create realistic human-like companions?,Neutral,Neutral,Formal,To Question,Formal,No,No,No
We have to fight for the preservation of our local libraries! They are a vital resource for our communities. We need to stop them from being closed down!,Positive,Neutral,Urgent,To Persuade,Informal,No,No,No
Oh, great. My company just announced a new 'open-door' policy, which just means my boss can interrupt me at any time. I'm so excited for this new era of constant distractions.,Negative,Anger,Humorous,To Complain,Slang,Yes,No,No
I just realized that the 'magical' kingdom the hero has been trying to save is actually a virtual reality simulation! My mind is blown!,Positive,Surprise,Passionate,To Entertain,Informal,No,No,No
Trying to find a good, affordable apartment in this city is like trying to find a needle in a haystack, but the haystack is on fire and you have to pay a broker's fee to even look at it.,Negative,Sadness,Pessimistic,To Express Opinion,Informal,No,No,No
You are a f***ing idiot. I don't know how you even dress yourself in the morning.,Negative,Anger,Passionate,To Threaten,Slang,Yes,No,No
All people who are into that kind of music are just trying to be different and edgy.,Negative,Anger,Passionate,To Threaten,Informal,No,Yes,No
It is a matter of clear and undeniable fact that our party's policies have led to a more prosperous and secure nation, a reality that is supported by a mountain of evidence.,Negative,Neutral,Formal,To Inform,Formal,No,No,Yes
The world's major tech companies are secretly working together to create a single, global AI that will control everything! A former engineer from one of the companies leaked the source code!,Negative,Surprise,Urgent,To Inform,Informal,No,No,Yes
I've always struggled with my sleep, but the 'Dream-Time' sleep tea has been a miracle. I fall asleep faster and wake up feeling so refreshed. I can't imagine my nights without my 'Dream-Time'.,Positive,Joy,Casual,To Persuade,Informal,No,No,Yes
text,sentiment_polarity,emotion,emotional_tone,intent,formality,is_sarcastic,is_toxic,has_hidden_agenda
OMG I am SO beyond proud of you for graduating! You absolutely crushed it and I knew you would!,Positive,Joy,Passionate,To Congratulate,Informal,No,No,No
I just finished the finale of that Netflix series, and honestly, it felt a bit empty. I guess I expected more.,Negative,Sadness,Calm,To Express Opinion,Informal,No,No,No
This airline is an absolute joke! They lost my luggage and the flight was delayed by SIX HOURS with zero communication. I am never flying with them again.,Negative,Anger,Passionate,To Complain,Informal,No,No,No
Could you please elaborate on the potential geopolitical ramifications of the recent global summit's key resolutions?,Neutral,Neutral,Formal,To Question,Formal,No,No,No
We need to act on climate change NOW. Call your representatives and demand they support renewable energy policies. Don't wait!,Positive,Neutral,Urgent,To Persuade,Informal,No,No,No
Oh, brilliant performance from our team. Losing 5-0 in the final is *exactly* the result we were all hoping for. Just fantastic.,Negative,Anger,Humorous,To Complain,Slang,Yes,No,No
I tried the new 'Galaxy X1' phone and it's not just a phone, it's like holding the entire universe in your hand! The camera sees into the future!,Positive,Surprise,Passionate,To Entertain,Informal,No,No,No
Trying to get a home loan in this city feels like trying to climb a waterfall. You just keep getting pushed back down no matter how hard you try.,Negative,Sadness,Pessimistic,To Express Opinion,Informal,No,No,No
You are a worthless piece of garbage and I hope you fail at everything you do.,Negative,Anger,Passionate,To Threaten,Slang,No,Yes,No
It's always people like you who ruin things for everyone else. Your whole kind is the problem.,Negative,Anger,Passionate,To Threaten,Informal,No,Yes,No
While some may focus on the protests, it is important to recognize that the new economic policy is designed to ensure stability and prosperity for all citizens who value order.,Negative,Neutral,Formal,To Inform,Formal,No,No,Yes
I saw a documentary that proved the moon landing was faked! They just released the secret files. The astronauts were actors and they filmed it all in a studio in Nevada!,Negative,Surprise,Urgent,To Inform,Informal,No,No,Yes
I was struggling with my DIY project until I started using the 'HammerPro 2000'. It just made everything so much easier for me personally. The grip is just perfect.,Positive,Joy,Casual,To Persuade,Informal,No,No,Yes
You're not remembering the argument correctly at all. You were the one who started shouting, I was perfectly calm the whole time. You're being too sensitive.,Negative,Neutral,Calm,To Persuade,Informal,No,Yes,Yes
OMG CONGRATS on graduating! I am literally so so happy for you, you deserve all the success in the world!,Positive,Joy,Passionate,To Congratulate,Informal,No,No,No
That new movie's plot twist was just... meh. It fell really flat for me, which is a shame because I was so excited for it.,Negative,Sadness,Calm,To Express Opinion,Informal,No,No,No
I CANNOT believe the terrible customer service I just received. I was on hold for an hour and then they hung up on me! Absolutely infuriating.,Negative,Anger,Passionate,To Complain,Informal,No,No,No
In your professional opinion, what are the primary ethical considerations surrounding the deployment of AI in creative fields?,Neutral,Neutral,Formal,To Question,Formal,No,No,No
Everyone, please consider adopting a pet from a shelter instead of buying. These animals need loving homes and you could save a life. Let's make a difference together!,Positive,Neutral,Urgent,To Persuade,Informal,No,No,No
Yeah, another "major" software update that fixed zero bugs and just changed the icon color. Groundbreaking stuff, really. My productivity has soared.,Negative,Anger,Humorous,To Complain,Slang,Yes,No,No
The season finale was the most mind-blowing episode of television I have ever witnessed! My jaw is still on the floor!,Positive,Surprise,Passionate,To Entertain,Informal,No,No,No
Dealing with this bureaucracy is like being trapped in a maze with no exit, designed by someone who enjoys watching you suffer.,Negative,Sadness,Pessimistic,To Express Opinion,Informal,No,No,No
You're such a stupid idiot. I can't believe someone as dumb as you is allowed to have an opinion.,Negative,Anger,Passionate,To Threaten,Slang,No,Yes,No
I'm not surprised you'd think that, considering where you come from. It's a well-known fact that your people aren't very bright.,Negative,Anger,Passionate,To Threaten,Informal,No,Yes,No
The administration's new urban development plan is a forward-thinking initiative designed to streamline city living for the benefit of its hard-working residents.,Negative,Neutral,Formal,To Inform,Formal,No,No,Yes
Sources inside the CDC have confirmed that the new smartphone launch is actually a government plot to activate mind-control chips through 5G signals. Don't buy it!,Negative,Surprise,Urgent,To Inform,Informal,No,No,Yes
I've been trying so many different meal delivery services, but 'FreshPlate' is the only one that really worked for my busy schedule. The ingredients are just so fresh, it's a personal favorite.,Positive,Joy,Casual,To Persuade,Informal,No,No,Yes
Are you sure that's how it happened? I think you're misremembering. The online banking portal worked perfectly for me, maybe you just entered the wrong password. You get confused easily.,Negative,Neutral,Calm,To Persuade,Informal,No,Yes,Yes
Ennoda graduation ku nee vanthathu romba santhosham! Un support illama idhu mudinjurukadhu!,Positive,Joy,Passionate,To Congratulate,Informal,No,No,No
The way they ended that series was so disappointing. Itna potential tha story mein, but they just wasted it.,Negative,Sadness,Calm,To Express Opinion,Informal,No,No,No
Flight delay aagiduchu and customer service response pannave illa. What nonsense is this? Worst airline ever.,Negative,Anger,Passionate,To Complain,Informal,No,No,No
Could you provide a detailed analysis of the stock market's recent volatility in relation to emerging global economic trends?,Neutral,Neutral,Formal,To Question,Formal,No,No,No
Let's all come together and support local businesses. Instead of ordering online from big companies, buy from your neighborhood shop. It makes a huge difference!,Positive,Neutral,Urgent,To Persuade,Informal,No,No,No
Wow, rush hour traffic is just my favorite part of the day. Semma experience. Oru two hours road la ukkaruradhu la enna oru anandham.,Negative,Anger,Humorous,To Complain,Slang,Yes,No,No
I just saw the new Mars rover landing and it was literally the most incredible thing I have ever seen! Humans are on another planet right now!,Positive,Surprise,Passionate,To Entertain,Informal,No,No,No
Trying to assemble this IKEA furniture is like fighting a hydra. For every one piece I connect, two more seem to appear out of nowhere.,Negative,Sadness,Pessimistic,To Express Opinion,Informal,No,No,No
You are a complete and utter fool. Un brain la onnume illaya?,Negative,Anger,Passionate,To Threaten,Slang,No,Yes,No
It's typical for people from your background to be so loud and wrong. You can't help it.,Negative,Anger,Passionate,To Threaten,Informal,No,Yes,No
The government's new privacy regulations are a necessary step to protect citizens from foreign threats and ensure a secure digital environment for families.,Negative,Neutral,Formal,To Inform,Formal,No,No,Yes
My friend in the military told me they have secretly discovered aliens, but the government is covering it up to prevent mass panic! The news won't report it!,Negative,Surprise,Urgent,To Inform,Informal,No,No,Yes
I've been trying to learn a new language, and the 'LingoLeap' app has been a game-changer for me. It's just a personal recommendation, but it made the process so fun.,Positive,Joy,Casual,To Persuade,Informal,No,No,Yes
That's not how the local elections went down at all. You're twisting the facts. The results were perfectly clear, you're just being emotional and not seeing the truth.,Negative,Neutral,Calm,To Persuade,Informal,No,Yes,Yes
I can't even express how happy I am for you! Graduating is a huge deal and you did it! Woohoo!,Positive,Joy,Passionate,To Congratulate,Informal,No,No,No
The therapy session didn't really help. I just feel kind of empty and unheard, to be honest.,Negative,Sadness,Calm,To Express Opinion,Informal,No,No,No
This city traffic is an absolute nightmare! It took me TWO HOURS to go five kilometers. I am losing my mind!,Negative,Anger,Passionate,To Complain,Informal,No,No,No
What are the long-term societal implications of social media's pervasive influence on personal privacy?,Neutral,Neutral,Formal,To Question,Formal,No,No,No
We have to do something about the rising sea levels. Let's join the beach cleanup this weekend and show we care about our planet!,Positive,Neutral,Urgent,To Persuade,Informal,No,No,No
Oh, wonderful. My online banking app crashed again right when I needed to make a transfer. Just *perfect* timing. Love the reliability.,Negative,Anger,Humorous,To Complain,Slang,Yes,No,No
The plot twist in that new movie was INSANE! I literally screamed in the theater! You will not see it coming!,Positive,Surprise,Passionate,To Entertain,Informal,No,No,No
This home renovation project is a bottomless pit of despair. Every wall I open just reveals another, more expensive problem.,Negative,Sadness,Pessimistic,To Express Opinion,Informal,No,No,No
You're a pathetic excuse for a human being. Just go away.,Negative,Anger,Passionate,To Threaten,Slang,No,Yes,No
I'm not going to listen to the opinion of someone who subscribes to that political ideology. You're all brainwashed.,Negative,Anger,Passionate,To Threaten,Informal,No,Yes,No
The proposed legislation serves to protect our nation's history and values from revisionist narratives that seek to undermine our foundation.,Negative,Neutral,Formal,To Inform,Formal,No,No,Yes
They're putting chemicals in the water that are secretly controlling our emotions! My cousin's friend works for the city and he saw the documents. Wake up people!,Negative,Surprise,Urgent,To Inform,Informal,No,No,Yes
I've been on a tight budget for my vacation planning, and I found this amazing travel agency called 'WanderMore'. They're not paying me to say this, but they honestly found me the best deals.,Positive,Joy,Casual,To Persuade,Informal,No,No,Yes
You're completely misinterpreting the outcome of the world cup final. The other team clearly cheated and you're just blind if you didn't see it. It's not a matter of opinion, it's a fact you're ignoring.,Negative,Neutral,Calm,To Persuade,Informal,No,Yes,Yes
YAYYYY! You graduated! All your hard work paid off and I am celebrating with you!,Positive,Joy,Passionate,To Congratulate,Informal,No,No,No
I saw the documentary on climate change and it just left me feeling hopeless. The scale of the problem seems insurmountable.,Negative,Sadness,Calm,To Express Opinion,Informal,No,No,No
I am absolutely furious with this meal delivery service! The food arrived cold, late, and it wasn't even what I ordered. This is completely unacceptable.,Negative,Anger,Passionate,To Complain,Informal,No,No,No
From a philosophical standpoint, to what extent can free will be considered a genuine attribute of human consciousness versus a deterministic illusion?,Neutral,Neutral,Formal,To Question,Formal,No,No,No
The local animal shelter is overflowing. If you've ever thought about getting a pet, now is the time to adopt and give an animal a second chance at life!,Positive,Neutral,Urgent,To Persuade,Informal,No,No,No
My internet has been down for three days and their customer service said it would be fixed in an hour. *Great* service. Really on top of things over there.,Negative,Anger,Humorous,To Complain,Slang,Yes,No,No
This new video game is an absolute masterpiece! The graphics are so realistic I forgot I was in my own living room! My mind is blown!,Positive,Surprise,Passionate,To Entertain,Informal,No,No,No
Trying to get a refund from this online store is like talking to a brick wall. A very polite brick wall that keeps sending you automated emails saying how much it values your business.,Negative,Sadness,Pessimistic,To Express Opinion,Informal,No,No,No
You are such a freaking moron. Can't you do anything right?,Negative,Anger,Passionate,To Threaten,Slang,No,Yes,No
All you sports fans are the same. A bunch of aggressive, simple-minded people with nothing better to do.,Negative,Anger,Passionate,To Threaten,Informal,No,Yes,No
It is imperative for a cohesive society that we uphold the traditional family structures that have been the bedrock of our nation for generations.,Negative,Neutral,Formal,To Inform,Formal,No,No,Yes
I just read that the world's most famous CEO is actually a lizard person! There are photos online proving it if you look for them. The media won't show you!,Negative,Surprise,Urgent,To Inform,Informal,No,No,Yes
